{
  "schema_version": "1.0",
  "environment": {
    "run_id": "20261019T171853Z-b316b8",
    "gpu_name": "NVIDIA RTX A2000 12GB",
    "gpu_driver": "597.16",
    "gpu_vram_mib": 12282,
    "gpu_max_sm_clock_mhz": 2100,
    "gpu_power_limit_w": 70.0,
    "os": "Windows-11-10.0.22631-SP0",
    "cpu": "Intel64 Family 6 Model 143 Stepping 8, GenuineIntel",
    "ram_gib": 31.2,
    "python": "3.12.15",
    "packages": {
      "torch": "2.8.0+cu128",
      "torchvision": "0.23.0+cu128",
      "timm": "1.0.26",
      "safetensors": "0.7.0",
      "onnx": "1.23.2",
      "tensorrt-cu12": "10.16.1.11",
      "tensorrt-cu12-libs": "10.16.1.11",
      "tensorrt-cu12-bindings": "10.16.1.11",
      "nvidia-ml-py": "13.615.71",
      "numpy": "2.4.2",
      "opencv-python-headless": "4.13.0.92",
      "jsonschema": "4.26.0",
      "psutil": "7.2.2",
      "pytest": "9.1.1"
    },
    "torch_cuda": "12.8",
    "cudnn": "91002",
    "corridorkey_sha": "97e55a453060745bead1befd293f6e523c4b845c",
    "weights_file": "CorridorKey_v1.0.safetensors",
    "weights_sha256": "74d614f7d92fc559a118c30a7deadedc3cacd8ef83dcb85a030d0bed7af8b20b",
    "ffmpeg_version": "ffmpeg version 7.1.1-full_build-www.gyan.dev Copyright (c) 2000-2025 the FFmpeg developers",
    "tensorrt_version": "10.16.1.11",
    "captured_utc": "2026-10-19T17:18:57+00:00"
  },
  "benchmarks": [
    {
      "config": {
        "config_id": "torch-fp16-512x512-ref1-idle",
        "runtime": "torch",
        "internal_w": 512,
        "internal_h": 512,
        "refiner": true,
        "load": "idle",
        "precision": "fp16",
        "posembed_interpolated": true
      },
      "camera_res": "1080p",
      "status": "ok",
      "runs": [
        {
          "model_ms": {
            "mean": 85.22672495524088,
            "median": 84.89267349243164,
            "p95": 86.62215538024903
          },
          "e2e_ms": {
            "mean": 90.50605533372921,
            "median": 90.15644999453798,
            "p95": 92.13268501043785
          },
          "stage_ms": {
            "upload": 0.34966400265693665,
            "hint": 1.214352011680603,
            "resize_in": 1.1571199893951416,
            "infer": 84.89267349243164,
            "resize_out": 1.711616039276123,
            "download": 0.5062080025672913
          }
        },
        {
          "model_ms": {
            "mean": 85.54607248942057,
            "median": 84.99609375,
            "p95": 88.37836570739748
          },
          "e2e_ms": {
            "mean": 90.87336666416377,
            "median": 90.28545001638122,
            "p95": 94.35946499288548
          },
          "stage_ms": {
            "upload": 0.35766398906707764,
            "hint": 1.2156000137329102,
            "resize_in": 1.1560959815979004,
            "infer": 84.99609375,
            "resize_out": 1.7075200080871582,
            "download": 0.5078080296516418
          }
        },
        {
          "model_ms": {
            "mean": 85.76392529805501,
            "median": 84.98944091796875,
            "p95": 90.03504905700683
          },
          "e2e_ms": {
            "mean": 90.97571899803977,
            "median": 90.1982500217855,
            "p95": 95.2352699561743
          },
          "stage_ms": {
            "upload": 0.3420639932155609,
            "hint": 1.2150400280952454,
            "resize_in": 1.1571199893951416,
            "infer": 84.98944091796875,
            "resize_out": 1.7131520509719849,
            "download": 0.5052479803562164
          }
        }
      ],
      "median_spread_pct": 0.14308462883249615,
      "spread_flag": false,
      "model_spread_pct": 0.12182471503572037,
      "e2e_spread_pct": 0.14308462883249615,
      "peak_vram_mib": 986.4,
      "vram_method": "nvml_device_minus_pre_cuda_baseline",
      "clock_start_mhz": 825,
      "clock_end_mhz": 1200,
      "temp_end_c": 90,
      "frames_per_run": 300,
      "warmup": 50,
      "input_frame": "synthetic green-screen pattern (seed 0)",
      "measured_utc": "2026-10-19T18:18:54Z",
      "torch_peak_alloc_mib": 741.7
    },
    {
      "config": {
        "config_id": "torch-fp16-512x512-ref0-idle",
        "runtime": "torch",
        "internal_w": 512,
        "internal_h": 512,
        "refiner": false,
        "load": "idle",
        "precision": "fp16",
        "posembed_interpolated": true
      },
      "camera_res": "1080p",
      "status": "ok",
      "runs": [
        {
          "model_ms": {
            "mean": 32.39461201349894,
            "median": 31.920639991760254,
            "p95": 34.054451942443855
          },
          "e2e_ms": {
            "mean": 37.53806566625523,
            "median": 37.075750005897135,
            "p95": 39.43899497389794
          },
          "stage_ms": {
            "upload": 0.31118400394916534,
            "hint": 1.2272319793701172,
            "resize_in": 1.1653120517730713,
            "infer": 31.920639991760254,
            "resize_out": 1.7208319902420044,
            "download": 0.5167359709739685
          }
        },
        {
          "model_ms": {
            "mean": 32.37071871439616,
            "median": 31.896575927734375,
            "p95": 34.842571640014654
          },
          "e2e_ms": {
            "mean": 37.529465000067525,
            "median": 37.03975002281368,
            "p95": 40.21806499513332
          },
          "stage_ms": {
            "upload": 0.31811198592185974,
            "hint": 1.2256799936294556,
            "resize_in": 1.16428804397583,
            "infer": 31.896575927734375,
            "resize_out": 1.7172479629516602,
            "download": 0.5172480046749115
          }
        },
        {
          "model_ms": {
            "mean": 32.27793752670288,
            "median": 31.893503189086914,
            "p95": 33.41117420196533
          },
          "e2e_ms": {
            "mean": 37.409093002400674,
            "median": 37.01555001316592,
            "p95": 38.52745498588774
          },
          "stage_ms": {
            "upload": 0.309904009103775,
            "hint": 1.2247200012207031,
            "resize_in": 1.1653120517730713,
            "infer": 31.893503189086914,
            "resize_out": 1.7223680019378662,
            "download": 0.5152159929275513
          }
        }
      ],
      "median_spread_pct": 0.16263433262453553,
      "spread_flag": false,
      "model_spread_pct": 0.08508567563887218,
      "e2e_spread_pct": 0.16263433262453553,
      "peak_vram_mib": 724.4,
      "vram_method": "nvml_device_minus_pre_cuda_baseline",
      "clock_start_mhz": 1492,
      "clock_end_mhz": 1192,
      "temp_end_c": 90,
      "frames_per_run": 300,
      "warmup": 50,
      "input_frame": "synthetic green-screen pattern (seed 0)",
      "measured_utc": "2026-10-19T18:19:36Z",
      "torch_peak_alloc_mib": 630.9
    },
    {
      "config": {
        "config_id": "torch-fp16-768x768-ref1-idle",
        "runtime": "torch",
        "internal_w": 768,
        "internal_h": 768,
        "refiner": true,
        "load": "idle",
        "precision": "fp16",
        "posembed_interpolated": true
      },
      "camera_res": "1080p",
      "status": "ok",
      "runs": [
        {
          "model_ms": {
            "mean": 193.0570376586914,
            "median": 193.01068878173828,
            "p95": 193.90069808959962
          },
          "e2e_ms": {
            "mean": 198.7929479999002,
            "median": 198.70690000243485,
            "p95": 199.7502950282069
          },
          "stage_ms": {
            "upload": 0.35070399940013885,
            "hint": 1.2195519804954529,
            "resize_in": 1.5411200523376465,
            "infer": 193.01068878173828,
            "resize_out": 1.726464033126831,
            "download": 0.5069440007209778
          }
        },
        {
          "model_ms": {
            "mean": 192.94161895751952,
            "median": 192.91187286376953,
            "p95": 193.82609786987305
          },
          "e2e_ms": {
            "mean": 198.60694766568486,
            "median": 198.6073000007309,
            "p95": 199.59712996787857
          },
          "stage_ms": {
            "upload": 0.34964799880981445,
            "hint": 1.2175840139389038,
            "resize_in": 1.5416319966316223,
            "infer": 192.91187286376953,
            "resize_out": 1.7254400253295898,
            "download": 0.5055040121078491
          }
        },
        {
          "model_ms": {
            "mean": 193.0284577433268,
            "median": 192.96358489990234,
            "p95": 193.98984375
          },
          "e2e_ms": {
            "mean": 198.75775233260356,
            "median": 198.68540001334623,
            "p95": 199.90303501253948
          },
          "stage_ms": {
            "upload": 0.3536960035562515,
            "hint": 1.2192639708518982,
            "resize_in": 1.5421439409255981,
            "infer": 192.96358489990234,
            "resize_out": 1.7254400253295898,
            "download": 0.5084640085697174
          }
        }
      ],
      "median_spread_pct": 0.051223346962440096,
      "spread_flag": false,
      "model_spread_pct": 0.051223346962440096,
      "e2e_spread_pct": 0.050149214909815124,
      "peak_vram_mib": 1698.6,
      "vram_method": "nvml_device_minus_pre_cuda_baseline",
      "clock_start_mhz": 1755,
      "clock_end_mhz": 1162,
      "temp_end_c": 89,
      "frames_per_run": 300,
      "warmup": 50,
      "input_frame": "synthetic green-screen pattern (seed 0)",
      "measured_utc": "2026-10-19T18:23:06Z",
      "torch_peak_alloc_mib": 1107.7
    },
    {
      "config": {
        "config_id": "torch-fp16-768x768-ref0-idle",
        "runtime": "torch",
        "internal_w": 768,
        "internal_h": 768,
        "refiner": false,
        "load": "idle",
        "precision": "fp16",
        "posembed_interpolated": true
      },
      "camera_res": "1080p",
      "status": "ok",